,ID,tweet,label
1361,sw_train_01362,vijana wametakiwa kujitambua na kujenga utaratibu wa kupima na kulinda afya zao ili kuwa na taifa lenye nguvukazi ya vijana watakaokuza uchumi wa nchi hususan kutokana na kubainika changamoto ya maambukizi ya virusi vya ukimwi kwa kundi hilo,positive
1362,sw_train_01363,bonus saving is good nimefungua hii akaunti personally,positive
1363,sw_train_01364,waziri wa sera bunge kazi vijana na ajira jenista mhagama leo februari amezindua mfumo wa kisasa wa ma,positive
1364,sw_train_01365,tar niliongozana na bw mussa gama mkurugenzi halmashauri ya kisarawe kufanya kikao muhimu cha mashirikiano kati,positive
1365,sw_train_01366,mdogowangu dengelesi anapendwa sana na cocosiku atutie aibu sijui tutaficha wapi sura zetu wasukuma wa mwanza,positive
1366,sw_train_01367,taarifa dkt hassan abbasi ataendelea kuwa msemaji mkuu wa serikali hadi pale atakapopatikana msemaji mkuu mwingine,positive
1367,sw_train_01368,kesho si ndio siku yetu ya kujifunza huku tukifurahia umoja wetu waswahili basi kujua mbinu za kupata kazi kirahisi ndugu,positive
1368,sw_train_01369,matunda yenye rangi ya njano kama machungwa na maembe yana kiasi kikubwa cha vitamini c mahususi katika kuongeza na kuimaris,positive
1369,sw_train_01370,ulaji wa apple la kijina na ndizi usaidia kupunguza uzito,positive
1370,sw_train_01371,repost from using repostregramapp multichoice imekuja na the punguzo miezi miwili,positive
1371,sw_train_01372,umoja wa mataifa chini ya uongozi wa umejiwekea lengo la kufikia usawa wa jinsia kwa kuwapatia wanawake ya ajira ndani ya chombo hicho katika ngazi zote na hadi sasa umefikia lengo hilo la katika uongozi wa ngazi y,positive
1372,sw_train_01373,matokeo chanya liverais magufuli katika uzinduzi wa jengo la tat,positive
1373,sw_train_01374,kuna haja ya kutoa elimu kwa jamii pamoja na kuongeza uhamasishaji juu ya umuhimu na hatima ya kielimu kwa watoto wa k,positive
1374,sw_train_01375,bkabla watu awajakufollow lazima wangalie profile yako weks profile ambayo inaeeza kuvutis watu kukufollow cbio tengeneza bio ambayo inaonyesha watu wanaweza kujifunza kitu kupitia wewe mfano wa bio isiokuwa na mvito nna miaka nakaa mbagala nasomea ufundi,positive
1375,sw_train_01376,wanamwita sugu sugu sugu sugu my brother jongwa hatari i re,positive
1376,sw_train_01377,leo kwenye leo tunaongelea ulinzi na uangalizi kwa mtoto je wewe unaelewa nini kuhusu hilo ungana na idrisa salum mwanakwetu chomboni pamoja na marafiki wa elimu ayubu bwanamadi,positive
1377,sw_train_01378,habari juma usijali tutakufahamisha mshindi huyo wa mil aliweza kupata kiasi hicho cha bonus kwa sababu aliweka mikeka mingi ya jackpot hivyo alipatia mechi nyingi katika kila mkeka aliokuwa ameuweka cheza sasa kupitia na wewe uweze kushi,positive
1378,sw_train_01379,karibu katika kipindi cha usikilize mikasa ya maisha na mapenzi na umtakie usiku mwema umpendae kwa,positive
1379,sw_train_01380,habari ahsante wa kuwasiliana nasi tuapenda kukufahamisha kwamba hata hicho kifurushi cha shilingi kipo bonyeza kisha chagua nunua bando kisha chagua intaneti na jiunge kifurushi kulingana na matumizi yako ahsante kwa kucha,positive
1380,sw_train_01381,karibu sana chief ukimaliza kusoma jisikie huru kutoa mawazo ya ziada au mawazo kinzani,positive
1381,sw_train_01382,nyama choma festival jumamosi hii pande za leaders club kwa kiingilio cha sh ukinunua tiketi mapema au sh,positive
1382,sw_train_01383,ishi na watu vizuri watendee wema mungu ndiye ataamua kukulipa kwa njia inayoonekana au kwa njia isiyoonekana,positive
1383,sw_train_01384,tunaomba namba yako na eneo unaloishi,positive
1384,sw_train_01385,naibu waziri wa maji na umwagiliaji atembelea banda la maonyesho la vitambulisho vya taifa nida nanenane,positive
1385,sw_train_01386,makamu wa rais samia suluhu hassan aipongeza sekta ya utalii nchini kwa mahusiano mazuri duniani kutokana na maendeleo ya teknolojia na upatikanaji taarifasoma zaidi gtgt,positive
1386,sw_train_01387,nchi ya tanzania na afrika kusini ni washirika wakubwa wa uchumi na maendeleo,positive
1387,sw_train_01388,lugha ni kiswahili tutena kwa kipindi hiki muhimu wakati hatujui kingereza au kiswahilini bora,positive
1388,sw_train_01389,mjumbe wa kamati ya hamasa na uchangiaji ya said mrisho alipofafanua kuhusu tiketi za kuingilia kwenye tukio kub,positive
1389,sw_train_01390,serikali kupitia sekta ya ujenzi imeanzisha utaratibu wa kufuatilia utendaji kazi wa mizani kwa saa kwa kutumia mfumo w,positive
1390,sw_train_01391,habari ahsante kwa kuwasiliana nasi pole sana kwa changamoto uliyoipata tunapenda kukufahamisha kuwa wateja wote walipewa mb kama pole,positive
1391,sw_train_01392,kocha wa wolves nuno espirito santo amethibitisha kuwa wawili hao wako fiti kuelekea mchezo wao wa leo dhidi ya leiceste,positive
1392,sw_train_01393,mapato yanatokana na gawio na michango ya kampuni taasisi na mashirika yameongezeka kutoka tzs bilioni mwaka ,positive
1393,sw_train_01394,videoklabu ya barcelona wamesha tua katika jiji la manchester united kucheza mchezo wao wa klabu bingwa ulaya dhidi ya manchester united mchezo utakao chezwa kesho jumatano,positive
1394,sw_train_01395,ujumbe mfupi sms wa kwanza kwenye simu ulitumwa disemba ambapo mhandisi neil papwoh wa canada aliandika mer,positive
1395,sw_train_01396,lengo hasa la kitabu hichi ni kuongeza hamasa kwa mabinti kuwa inawezekana pia kuwajengea uthubutu ndani ya pb ya,positive
1396,sw_train_01397,abubakar tafadhali tuambie ni tatizo gani haswa hutokezea unapotumia wifi kwa laini yako ya zantel ili tuweze kukusaidia,positive
1397,sw_train_01398,shukrani musoma shukrani mhe mkuu wa mkoa brother adam malima tuseme nini tenanyumbani kumenoga,positive
1398,sw_train_01399,muonekano wa barabara ya bwanga biharamulo km ambayo ujenzi wake kwa kiwango cha lami umekamilika barabara hiyo inau,positive
1399,sw_train_01400,so kwa mwalimu wangu wa tuition primary aliitwa bryson huyu ndo alinipa msingi na kunifanya niipende hesabusijui yuko wapi ila mara ya mwisho nikikutana nae kwenye kitimoto sinai tukanywa na bia bila kumsahau ndimbopure math advancemungu azidi kuwabariki,positive
1400,sw_train_01401,miaka iliyobadilisha maisha ya tuliowengi shukurani sana,positive
1401,sw_train_01402,huwezi kuamini wajukuu wako na ni wapenzi na wanataka kuoana,positive
1402,sw_train_01403,rahisi kupata simu hiyo ahsante lm,positive
1403,sw_train_01404,suala la tume huru linapaswa kuwa ni movement ya wananchiwanasiasa watatukuta mbele ya safari tukiwa tumeanza kutifuana na,positive
1404,sw_train_01405,habari aklei asnate sana kwa ushauri wako tutaufanyia kazij,positive
1405,sw_train_01406,tunaposema tunazungumzia kazi kubwa ya kuhamasisha wanawake kuwa viongozi kuanzia mwanamke mwenye miaka ,positive
1406,sw_train_01407,furaha inakuja pale unapoacha kulalamika kuhusu matatizo uliyonayo na kumshukuru allah kwa matatizo usiyokuwa nayo mwisho tumshukuru mungu kwa kila jambo,positive
1407,sw_train_01408,tunajivunia kwa mwaka wa tatu kuwa na panership kupitia tuzo za na imetufungulia milango m,positive
1408,sw_train_01409,rais akivuta utepe pamoja na balozi wa china hapa nchini wang ke kuashiria ufunguzi wa maktaba mpya ya chuo kikuu cha dar es salaam yenye uwezo wa kuchukua wanafunzi kwa wakati mmoja wengine pichani ni viongozi waastaafu mbalimbali kutoka nchini tanzania,positive
1409,sw_train_01410,je wajua kuwa watu huzishika nyuso zao aghalabu mara kwa lisaa limoja basi ni vyema tujali afya zetu kwa kunawa mikono yetu mara kwa mara na maji safi yanayotiririka kwa sabuni au vitakasa,positive
1410,sw_train_01411,kamati ya ya miundombinu imesema bajeti ya wizara ya ujenzi uchukuzi na mawasiliano kwa mwaka wa fedha imeshuka kwa asilimia saba kutoka tsh trilioni mwaka hadi tsh trilioni mwaka ujao wa fedha,positive
1411,sw_train_01412,kesho januari rais anaanza ziara ya kikazi visiwani zanzibar ambapo ataweka jiwe la msingi la,positive
1412,sw_train_01413,mkuu wa wilaya akisalimiana na wasanii mbalimbali waliojumuika katika ziara ya makamu wa rais,positive
1413,sw_train_01414,shukrani sana kwa kuwa balozi mzuri,positive
1414,sw_train_01415,pia fahamu ya kuwa tunafanya maboresho kwenye menyu zetu za vifurushi ili kuwapatia vifurushi bomba kabisa wateja wetu tafadhali piga au chagua saizi siku wikimwezi au halichachi kupata vifurushi vyetu vilivyobo,positive
1415,sw_train_01416,na ndio maana kujenga barabara hii ni muhimu ili yake magari yatakayokuja kudhughulika hapa mitambo wawekezaji watakaokuja hapa usafirishaji wa madini haya barabara isije ikawa kikwazo raisjpmruangwa,positive
1416,sw_train_01417,taarifa kwa wakulima na umma kwa ujumla juu ya muelekeo wa mvua nchini kutoka tma link,positive
1417,sw_train_01418,hongera mh hongera mama samia suluhu hongera wabunge na madiwani wateule wote tukajenge nchi sasa,positive
1418,sw_train_01419,ali khamis mteja wetu wa thamani endelea kuongeza salio zaid na zaid ili uweze kushinda na jero yako promosheni asante sana kwa kuzid kuweka vocha tafadhali wajulishe na wengine wengi,positive
1419,sw_train_01420,leo kwenye hotuba yangu nilipoalikwa kwenye mkutano wa mbunge wa mbozi nimewaambia wananchitutanaka tume huru,positive
1420,sw_train_01421,condom huzuia mimba zisizotarajiwa na haliyakuwa mnajamiana tuachane na hilo condom pia inakukinga na maambukizi ya magojwa hatarishi ya zinaa km syphilis gornorrhea virusi vya ukimwi etc,positive
1421,sw_train_01422,ukipata pesa au cheo hakikisha unawanyanyua walio chini utapata baraka usitumie pesa zako au cheo chako kuwanyanyasa w,positive
1422,sw_train_01423,habari ahsante kwa kuwasiliana nasi pole sana kwa changamoto uliyoipata tulikuwa na tatizo la mtandao ila kwa sasa huduma ya internet imerejea naomba kufahamu kwa sasa bado unashindwa kutumia internet ahsante wn,positive
1423,sw_train_01424,coco amp denge nimependa namna wametoa elimu ya kufanya biashara mtandaoni wengi hatujui kutumia kukuza biashara,positive
1424,sw_train_01425,watani zangu kagera wao ni maneno na kujidai tu kagera inachangia tu ya pato la taifa gdp na vile vile ya wakaz,positive
1425,sw_train_01426,tokea mabibo kwa masai play ya maalum kwa wanaoisikiliza kwa haya masa,positive
1426,sw_train_01427,dkt tizeba asisitiza ushirikishwaji wa tma kwenye miradi mbalimbali ya maendeleo ya kilimo kwa taarifa zaidi tembelea,positive
1427,sw_train_01428,ewe kijana mwenye uwezo sasahivi wa kufanya anasa za kila aina nakushauri pesa hizo kajenge weka akiba kwaajili ya watoto,positive
1428,sw_train_01429,madaktari bingwa wa watoto wa taasisi ya moyo jkci na prof pan xiang bin wafanya upasuaji wa bila kufungua kifua kupitia mshipa wa damu wa kwenye paja,positive
1429,sw_train_01430,je mavazi haya yanafaa kuwa maalum kwa ajili ya yametengenezwa na mbunifu mdogo aitwaye,positive
1430,sw_train_01431,upo eneo gani mteja tunaomba details vizuri ili tuweze kufuatilia,positive
1431,sw_train_01432,ushiriki wa vijana kwenye kilimo ni mkubwa sana nchini rwanda tunawajibika kuwasaidia vijana ili waweze kufanya kilimo cha kibiashara kwa lengo la kuinua kipato chao wenyewe na kuwajengea mazingira ya kukitegemea na si kutengenea ajira pekee waziri mkuurwanda,positive
1432,sw_train_01433,episode imekaa kidegree sana ina mafunzo mengi ndani yake hususani sisi raia wa kidigitali tunaotumia mitanda,positive
1433,sw_train_01434,nampelekea boks la chaki km zawadi,positive
1434,sw_train_01435,mshauri kujiamini na kua na furaha ni silaha zaidi hata ya nuclear,positive
1435,sw_train_01436,thamani ya mauzo ya madini nje ya nchi iliongezeka kutoka usdmsawa na tzs bl hadi kufikia usd blsawa na tzsbl,positive
1436,sw_train_01437,habari pole sana kwa changamoto kama unapata shida ya mtandao tunaomba namba yako inbox kwa msaadaka,positive
1437,sw_train_01438,wadau walioshiriki kutoa maoni kuboresha muswada ni wananchitlsmoatmisatanmctlhrctefnola na wabungemhenape,positive
1438,sw_train_01439,endelea kujifunza na kupata taarifa sahihi zaidi kuhusu gesi asilia na ugunduzi wake,positive
1439,sw_train_01440,happy bihday mh rais mstaafu wa awamu ya nne dkt kwa kutimiza miaka mwenyezi mungu akujalie umri mrefu na af,positive
1440,sw_train_01441,kumbe tunaifukuzia china kwa wingitushafika bilioni toka milion mpk milioni tofauti hapo ni m tumepiga hatua kubwa,positive
1441,sw_train_01442,habari unahitajika kutembelea tawi lililo karibu nawe na kujaza fomu,positive
1442,sw_train_01443,tunashukuru sana mh kwa kutembelea banda letu kujionea mkaa mbadala wa mianzi,positive
1443,sw_train_01444,harith rashid kujiunga na kifurushi piga namba au kisha chagua namba saizi yako,positive
1444,sw_train_01445,tuhamasike kupinga rushwa ya ngono vyuoni na mahala pa kazi ili kuwa na kwa maendeleo,positive
1445,sw_train_01446,baba wa taifa julius kambarage,positive
1446,sw_train_01447,huu ni zaidi ya upendo tuendelee kushikana hakika tutashinda,positive
1447,sw_train_01448,usikose kutazana droo ya mechi za mtoano za mashindano ya caf confideration cup dstv inakuletea live kuona droo hizi hapo kesho saa usiku kupitia ss kifurushi cha bomba sh tu lipia mapema kifurushi chako kujiunga na dstv piga ,positive
1448,sw_train_01449,makamu wa rais mama samia suluhu amewaagiza wakuu wa mikoa yote kutenga bajeti ili kuhakikisha inafany,positive
1449,sw_train_01450,kuna nguvu ya ajabu sana when you sta thinking positively inapunguza hofu ya kupoteza au kufeli,positive
1450,sw_train_01451,jana niliongea na dk bashiru alinipigia nafikiri alitaka kutest kwamba vipi salamu zake zimefika nimemwambia katika,positive
1451,sw_train_01452,sisi tuko pamoja kwenda na serikali hadi mwisho kuhakikisha suala hili linafanikiwaila ni vyema lifate miiko na utekelezaji w,positive
1452,sw_train_01453,leo ni siku ya sauti duniani na kupitia tutakujuza ni kwa namna gani unaweza,positive
1453,sw_train_01454,habari ahsante kwa kuwasiliana nasi tunashukuru kwa mrejesho wako endelea kuwa supa na mtandao supa tanzania ahsante jm,positive
1454,sw_train_01455,kwa jide imesound good kabiasa yaani,positive
1455,sw_train_01456,capital city marathon itakuwa ikifanyika kila mwaka kuanzia sasa na lengo likiwa kukua na kuwa mbio za kimataifa zitakazoshirikisha wakimbia wengi duniani,positive
1456,sw_train_01457,hii ni hatua muhimu sana pongezi kwa kikao hicho binafsi ninaamini kuwa pamoja na miundombinu ndani ya msitu wa pugu kuan,positive
1457,sw_train_01458,moja ya mambo muhimu ambayo sisi watu wazima tunaweza kufanya kwa watoto wadogo ni kuwajenga kwenye namna ambayo tungetaka wa,positive
1458,sw_train_01459,amani na utulivu iwe kwa afrika nzima,positive
1459,sw_train_01460,waziri wa afya amesema tanzania imepata pongezi kutoka kituo cha kimataifa cha kufatilia kutathmini kutoa taarifa na kuchukua hatua cdc kwa kufanya vizruri katika utekelezaji huo hasa katika magonjwa ya mlipuko,positive
1460,sw_train_01461,habari a man of people tafadhali tunaomba utupe taarifa kamili kuhusiana na tatizo la network namba ya simu inbox mahali husika na tatizo limeanza lini,positive
1461,sw_train_01462,asanteni sana kwa kushare post yangu ya jana hatimae nimepata oda ya kitanda dizaini kama ya kile nlichopost jana oda tu,positive
1462,sw_train_01463,wanakutana na dimbani mara yat mwisho walipochuana utd walishinda leo unadhani itakuaje ingia kuweka bashiri yako ushinde,positive
1463,sw_train_01464,sasa unaweza kulipia bili zako uwapo nyumbani kwakoni rahisi piga jaribu leo,positive
1464,sw_train_01465,episode hii ni tamthilia yenye kuburudisha na iliyojaa mafunzo mengi ndani yake hususani sisi raia wa ki,positive
1465,sw_train_01466,klabu ya aston villa imetangaza kumsajili nyota wa soka mbwana kwa mkataba wa miaka minne na nusu kuto,positive
1466,sw_train_01467,karibu sana mteja wetu,positive
1467,sw_train_01468,wizara imeweka kanuni kunufaisha taifahakuna mgodi utakaotolewa leseni bila serikali kuwa na hisa wachmbaj wazawa st,positive
1468,sw_train_01469,habari yakotunashukuru kwa kushiriki nasi kwenye ukurasa wetu,positive
1469,sw_train_01470,kipindi cha pili kichuya anawanyanyua wana msimbazi ,positive
1470,sw_train_01471,mbowe ashinda kwa kishindo uenyekiti chadema,positive
1471,sw_train_01472,asante kwa kuwa nasitumia ezypesa na ushinde,positive
1472,sw_train_01473,mungu tusaidie mafirstborn wote amen,positive
1473,sw_train_01474,katika kuhakikisha tunafikia wanahabari wana wajibu wa kuhakikisha wanafichua na kukemea maovu yote wanayokutana nay,positive
1474,sw_train_01475,jenga bet turkey vs greece mara ya mwisho timu hizi zimekutana kwenye mechi ya kirafiki nov ambapo walitoka sare ya itakuwaje leo cheza kwenye masoko zaidi ya ndani ya mechi ushinde zaidi cheza,positive
1475,sw_train_01476,jamaa yetu wa suti leo pia anatusogezea mambo mazuri mcheki hapa ,positive
1476,sw_train_01477,nashidwa kufahamu na kwa namna gani naweza kufikisha shukran zangu kwako kwa mchango wako kupromote kitabu uzinduzi ulikuwa mzuri ndani ya chuo kikuu cha waislam morogoro kwa mahitaji whats no ,positive
1477,sw_train_01478,raha ya kufundisha watoto akisema tu sad na mi nakuwa sad anyway knowing my kids mood is my first priority https,positive
1478,sw_train_01479,ni imani yetu kuwa sisi kama benki siyo tu ni biashara au biashara ipatayo faida tu ni zaidi ya hayo benki ya crdb ni,positive
1479,sw_train_01480,simbachawene aagiza bidhaa huduma zishuke bei waziri wa nishati na madini george simbachwene amesisitiza,positive
1480,sw_train_01481,mh mbunge wa tarime vijijini akizungumza na wananchi wa nyamongo kesho atakuwa sirari,positive
1481,sw_train_01482,uhuru michezomanchester city mabingwa kombe la ligi,positive
1482,sw_train_01483,azaki zina mchango mkubwa kwenye uchambuzi wa sera na sheria mbali mbali tukutane siku ya kesho kujifunza zaidi,positive
1483,sw_train_01484,hakuna jipya china ya jua by,positive
1484,sw_train_01485,tutamiss sana uwepo amr moustafa fahmy alikuwa katibu mkuu mwenye uwazi sana katika utendaji wake na kizuri alikuwa anaelek,positive
1485,sw_train_01486,bao la kweli kabisa karibu zantel upige bao,positive
1486,sw_train_01487,usalama umeimarishwa katika viwanja vya ndege vya ufaransa na ujerumani kuelekea kipindi hiki cha sherehe za krismasi na mwaka mpya ambapo viwanja vya ndege vya ulaya hupokea ujumbe wa tahadhari kutoka nchi mbalimbali duniani baadhi ukiwa wa kuaminika,positive
1487,sw_train_01488,waziri lukuvi pia amewataka wananchi kuwataja hadharani maofisa ardhi wote wanaojihusisha kutengeneza migogoro kushirikiana na matapeli au kushindwa kutoa huduma kwa wananchi ipasavyo katika sekta hiyo,positive
1488,sw_train_01489,asante kwa kunipa nafasi na kuniamini nikusaidie mh mipango ufuatiliaji na maelekezo yako vinatupa nguvu s,positive
1489,sw_train_01490,tafadhali tufahamishe umepata taarifa za ofa hii kwa njia gani kwa msaada zaidigift,positive
1490,sw_train_01491,mipango imara ya kufikia lengo imewekwana imani yetu kuwa tutafanikiwa wizara yetu hukusanya sehemu kubwa sana ya makadirio,positive
1491,sw_train_01492,hongera mkuu arusha tanzania,positive
1492,sw_train_01493,hatutakiwa kuhukumu mungu pekee ndo anajukumu la kuhukumu kwa mujibu wa ukristo,positive
1493,sw_train_01494,timu ya hatuwezi kataa ombi la kuwapa elimu zaidi wananchi wetu kwenye,positive
1494,sw_train_01495,imeanza kuilipa mkopo iliotumia kujenga sgr baada ya kipindi cha neema cha miaka ilichoongezewa kumalizik,positive
1495,sw_train_01496,uongozi ni dhamana,positive
1496,sw_train_01497,kama vile miili yetu ilivyo na uhitaji mkubwa wa chakula basi hata mioyo yetu inahitaji kujenga mahusiano mazuri na mola,positive
1497,sw_train_01498,tumelenga zaidi matokeo na kuufanya uwajibike na uheshimiwe zaidi kuhusu mabadiliko mapya yanayoendelea ndani ya umoja huo,positive
1498,sw_train_01499,waziri mkuu kassim majaliwa amesema ameridhishwa na kasi na viwango vya ujenzi wa mfumo wa reli ya kisasa sgr inayojengwa na kampuni ya yapi merkezi soma zaidi gtgt,positive
1499,sw_train_01500,kwa morombo tayari vibehii nchi raha ni maamuzi tu imagine watu wanakula bapa na nyamachoma huku wanabadilishana mawazo mda huu,positive
1500,sw_train_01501,mwambie neno moja mama mkwe wako kuhusu mwanawe me asante sana kwa kunizalia atm mashine,positive
1501,sw_train_01502,je wajua kwa nini tunahitaji kupata chanjo dhidi ya uviko chanjo husaidia sana kuimarisha kinga mwili na ina ufanisi mkubwa imethibitishwa na shirika la afya duniani wh,positive
1502,sw_train_01503,rais ameshawatunuku kamisheni maafisa wanafunzi wa jeshi la wananchi tanzania jwtz kundi katika,positive
1503,sw_train_01504,nashukuru nilishapata japo kuna mwana na elimu yake kubwa aliniambia nilichokifanya matokeo ni baada ya miak,positive
1504,sw_train_01505,habari goodluck pole sana kwa kuchelewa kupata tiketi yako tafadhali tutumie dm namba yako ya simu tuweze kuangalia kwa upande wetu mt,positive
1505,sw_train_01506,habari asante kwa kuwasiliana nasi na pole kwa changamoto hiyo tuandikie ujumbe unaopta kwa msaada zaidibahati,positive
1506,sw_train_01507,nini tufanye kusaidia afya bora na akili makini kwa mama mja mzito na watoto wetu haiwezekani watu wetu wapoteze maisha tuseme mapenzi ya mungu mwangabora na dr pius,positive
1507,sw_train_01508,nakuandikia pongezi na shukrani kwa miaka katika kiti ulichopo,positive
1508,sw_train_01509,usikubali kujenga kawaida kwani unayo nafasi ya kujenga mjengo wa kisasa uutakao kadiri ya uwezo wako utafanyaje wachek,positive
1509,sw_train_01510,utabiri wa hali ya hewa wa saa zijazo kuanzia saa usiku wa leo ,positive
1510,sw_train_01511,habari herbe msirikale pamoja sana endelea kufurahia huduma za tigo,positive
1511,sw_train_01512,utabiri wa hali ya hewa wa saa zijazo kuanzia saa usiku wa leo tarehe ,positive
1512,sw_train_01513,leo ni siku ya radio duniani dunia leo inaadhimisha siku ya radio redio ni chombo kinachozungumza na mtu na mamilioni ya watu duniani ambao wasingeliweza kupata habari,positive
1513,sw_train_01514,mtakuwwa gt mtandao wa kutokomeza ukatili wa kijinsia kwa wanawake na watoto ulianzishwa ili kusimamia shughuli zote za,positive
1514,sw_train_01515,halmshauri ya wilaya ya nyanghwale mkoani geita imepokea kiasi cha shilingi bilioni kwa ajili ya ujenzi wa hospitali ya wilaya huku halmashauri hiyo ikijipanga kuhakikisha mradi huo,positive
1515,sw_train_01516,kikosi cha timu ya temesa fc leo kimecheza mechi ya kirafiki dhidi ya timu ya zi,positive
1516,sw_train_01517,asante kwa kufanikisha safari yetu ya mwaka tunakutakia amani pamoja na afya njema kheri ya sikukuu za christmas na mwaka mpya,positive
1517,sw_train_01518,niwapongeze sana ndugu zangu na kwa kuisaka na kuipata fursa ya ni kw,positive
1518,sw_train_01519,asante kwa kutembelea ukurasa wetu mrme,positive
1519,sw_train_01520,pata tuzo kabambe na dstv lipia kwa wakati kifurushi chako na unufaike na punguzo kubwa katika maduka hoteli na migahawa,positive
1520,sw_train_01521,mnafanya kazi bora kabisa kwa kiswahili safi na kimombo kizuri mungu awabariki mzidi kuitumikia jamii can i get a thunderou,positive
1521,sw_train_01522,inategemea unatoa shilingi ngapisuzy,positive
1522,sw_train_01523,ahsante kwa kutembelea ukurasa wetu,positive
1523,sw_train_01524,chakula bora na salama hukuweka mbali na magonjwa,positive
1524,sw_train_01525,ka mkubwa me mdau wako sana wanguvu naomba kujua kidogo kuhusu william anne ambae nimckia alikuwa hack tishio na pia kevin mitnick is an american computer security consultant author and a black hat turned white hat hacker blessed,positive
1525,sw_train_01526,usisahau kumpigia kura diamond platinumz ili ashinde tuzo ya bet kumbukumbu ushindi wa diamond ni kuitangaza tanzan,positive
1526,sw_train_01527,ahsante kwa kuwasiliana nasisamahani ndugu mtejavipi kwa siku ya leohali imetengamaa au bado kuna tatizolm,positive
1527,sw_train_01528,kuelekea afcon u zimebakia siku mashindano hayo kuanza aprili ,positive
1528,sw_train_01529,pole sana kwa usumbufu tunaomba namba yako tushughulikie hili tatizo,positive
1529,sw_train_01530,wanakwambia hiviii usipitwe na muda wa kula bata la uhakika unapotumia au na kuji,positive
1530,sw_train_01531,ander herrera akipewa kazi ya kukaba mtu mmoja tu hakuna bora kama yeye barani ulaya sasa hivi,positive
1531,sw_train_01532,faida mojawapo kubwa ya hili zoezi linachoma calories kwa haraka zaidi halina utofauti na zoezi la kutembea sema hili u,positive
1532,sw_train_01533,washiriki toka wilaya ya kilosairamba na mpwapwa ambao ni walimu wa elimu ya awali katika ufunguzi wa mafunzo ya kuwa,positive
1533,sw_train_01534,ninje wa chalenji apewa ngorongoro heroes gtgtgt,positive
1534,sw_train_01535,habari ahsante kwa kuwasiliana nasi pole sana kwa changamoto uliyoipata tunapenda kukufahamisha kuwa wateja wote walipewa mb kama pole lakini pia tuliweza kuwarudishia vifurushi vyao walivyojiunga na kushindwa kuvitumia kwa siku husika,positive
1535,sw_train_01536,kufikia usawa wa kijinsia inatubidi kubadili mifumo ya elimu yenye ufanisi inayotoa usawa huduma bora za elimu kwa wote,positive
1536,sw_train_01537,baadhi ya washindi wa zawadi mbalimbali za valentines wakisambaza luv katika ofisi za clouds media group,positive
1537,sw_train_01538,utoaji chanjo ya uviko mkoani arusha unaridhisha naibu katibu mkuu anayeshughulikia afya dkt grace mag,positive
1538,sw_train_01539,katibu wa siasa na uenezi bw jonathan masele amesema hatua zinazoendelea kuchukuliwa na rais zitasaidia maendeleo ya nchi na taifa pia,positive
1539,sw_train_01540,serikali inatoa pole kwa watumiaji wa instagram facebook na instagram,positive
1540,sw_train_01541,binti akikosea haina budi kumsamehe na kumpa nafasi ya pilihii itaongeza chachu ya kusoma kwa bidii ili kusa,positive
1541,sw_train_01542,nimefurahi sana comrade kinana kubaki kama katibu mkuu ni kiungo muhimu katika kujenga ccm mpya chini ya mwenyekiti mpya,positive
1542,sw_train_01543,ishi na watu vizuri watendee wema mungu ndiye ataamua kukulipa kwa njia inayoonekana au kwa njia isiyoonekana,positive
1543,sw_train_01544,erikali imesema imedhamiria kuwanufaisha wananchi kupitia rasilimali za nchi,positive
