,ID,tweet,label
370,sw_train_00371,msimamo wa ligi kuu ya ujerumani bundesliga,neutral
371,sw_train_00372,bro na sister nawaona peace xna zero majivuno bright talented hawakeri yan mungu,neutral
372,sw_train_00373,hapanahizi events ni fursa za kuingiza kipato kwa wafanyabiasharazinakusanya wateja wengi kwa pamojahakuna kiingilio na tofauti ya bei ni kati ya jero mpaka bukusio mbaya,neutral
373,sw_train_00374,mzigo genuine mzee,neutral
374,sw_train_00375,fumbo lingine ni mafanikio ujui utafakiwa ln but unakomaa unasemaipo cku na mm ntatoboaln ss,neutral
375,sw_train_00376,hata nyinyi tunachukua ushindi kama tumesimama,neutral
376,sw_train_00377,habari za siku kutoka uhuru digital novemba ,neutral
377,sw_train_00378,ukisema unapenda mwenye komweunaambiwa kwahiyo sisi ambao hatuna ni wabayakupangiana tu,neutral
378,sw_train_00379,anaweza kujiunga kwa kutuma neno kubali kwenda nambari au kama endapo atapendelea kujiunga kwa online abonyeze sajili sasa kupitia tovuti yetu kisha ajaze namba yako kwenye kisandaku cha rafiki namba lm,neutral
379,sw_train_00380,watu wengi ambao walipata experience ya madhira ya uviko hawasiti kupata chanjo kuliko ambao haikuwatwanga vizuri kwanini inakua hivyo,neutral
380,sw_train_00381,leo mpaka alhamisi kuna hela kwa muhindi mimi nimetengeneza bomu hili linaitwa ngumu kumeza odds kubwa kubwa kama h,neutral
381,sw_train_00382,total afcon cairo taifa stars yachapwa bila na algeria dakika ,neutral
382,sw_train_00383,nachoshukuru imeanza kufungia simu kwa awamu ili athari isiwe kubwa ila kinachotakiwa kuwe na mazingira rahisi k,neutral
383,sw_train_00384,nilikuwa chuo babyndo kituo cha karibuhalafu si umeniaga unalala,neutral
384,sw_train_00385,habari edward ahsante kwa kuwasiliana nasi naomba nikufahamishe kuwa tulikuwa na tatizo la kimtandao kwenye upande wa intanet mafundi wetu wamelifanyia kazi na sasa huduma ipo sawa tunaomba radhi kwa usumbufu uliyojitokeza sc,neutral
385,sw_train_00386,next episode yule mkaka alomshauri chale ovyo tunaomba asimame kuna kiti twataka ona,neutral
386,sw_train_00387,habari asante kwa maoni yako tutafanyia kazika,neutral
387,sw_train_00388,mbali na uraia wa dr kigwangalla pia anadaiwa kuwa hatumii jina halisi na kwamba jina lake ni said bagaile ambaye,neutral
388,sw_train_00389,kama tafiti za zilionesha vijana ni nguvu kazi ya taifa kwa ni kipi kilifanyika kulipa suppo kundi hilotuwe wakweli tuache siasakwa maana kwa hizo asilimia hili ndio kundi muhimu kwa maendeleo ya uchumi wa nchi hiitukae chini tutafakari,neutral
389,sw_train_00390,sahivi ukirudi shule point gani unaweza ukaielezea vizuri kabisahadi na mifano ya kweli mimir government suppo,neutral
390,sw_train_00391,habari pole kwa usumbufu uliojitokeza kuna tatizo la kiufundi kwa upande wa tigopesa na wataalam wetu wanafanya jitihada za kutatua tatizo hilo mapema iwezekanavyo tafadhali subiri tutakufahamisha litakapokuwa limekamilika,neutral
391,sw_train_00392,naumiaga sana kuona watu wanajitoa akili huku wanajua kila kitunajizuiaga nashindwa,neutral
392,sw_train_00393,shule za kata zikikosa utaratibu wa kuzuia lugha za makabila shulenihudhoofisha uwezo wa kujua lugha mbali mbali kwa wanaf,neutral
393,sw_train_00394,redio za kijamii na magazeti yalihusishwa katika mradi wa ili kuchagiza ajenda ya jinsia redio z,neutral
394,sw_train_00395,habari ahsante kwa kuwasiliana nasi tunaomba ufafanuzi tatizo ni nini tafadhali lililosababisha kusema hivyoili tuweze kulitatua au kukupatia ufafanuzi yakinifu ahsante rp,neutral
395,sw_train_00396,tumepokea changamoto hiyo tunaifanyia kazi mteja wetu,neutral
396,sw_train_00397,ni heshima kubwa kwetu tutalipa imani hii kwa kuwafanyia kazi watanzania,neutral
397,sw_train_00398,kajaribu kuwashauri mashabiki wa arsenal wakikuelewa nami sina la kupinga,neutral
398,sw_train_00399,mmoja wa abiria aliyenusurika kifo baada ya boti ya lulimbe waliyokuwa wakisafiria kutoka kemondo wilayani bukoba kuelekea rushonga bumbire wilayani muleba kuwaka moto ghafla ameeleza mbinu iliyomuokoa gtgtgt,neutral
399,sw_train_00400,ugenini mgeni unatumia kinywaji gani mimi pepsi moja baridi halafu kwanza nipeni chaja wakati huo dagaa zipo jikon,neutral
400,sw_train_00401,katika miaka mitatu iliyopita matumizi ya afya yamepungua kwa huku malipo ya deni yakiongezeka kwa tun,neutral
401,sw_train_00402,sekta ya mawasiliano ya simu afrika inakua kwa kasi hii ni sekta muhimu kuendelea kupewa kipaumbele ili kukua zaidi kwan,neutral
402,sw_train_00403,majira ijumaa machi ,neutral
403,sw_train_00404,taarifa toka mamlaka ya hali hewa tanzania tma tukio uwepo wa mvua kubwa siku alhamisi februari baadhi,neutral
404,sw_train_00405,habari pole sana kwa changamoto tunaomba namba yako dm kwa msaada zaidika,neutral
405,sw_train_00406,askofu wa jimbo katoliki la tanga mhashamu anthony banzi akiwasha mishumaa ikiwa ni sherehe yake ya jubilee ya miaka ya,neutral
406,sw_train_00407,bwana viju cherian managing director akiongea katika ufunguzi wa tawi lao jipya mtaa wa uhuru kariako,neutral
407,sw_train_00408,imenitoa relini sana lengo ilikuwa kuzuia masta asiwe na ulinzi thabiti na gavoo by then haya yalikuwa ya kawaida tunaj,neutral
408,sw_train_00409,fedha za walipa kodi zinatumika kuchagiza vimbunga kusambaza ukame na ongezeko la joto kuyeyusha theluji na kubabua matumbawe kuangamiza dunia asema wiki hii akiwa ziarani austria,neutral
409,sw_train_00410, kama mechi iliyohailishwa haitachezwa kufikia masaa sabini na mawili au hakuna taarifa ambayo tunaipata kuhusiana na mechi hii baada ya kuhailishwa basi bashiri zitabatilishwa,neutral
410,sw_train_00411,tanzania bila mifuko ya plastiki inawezekana kesho juni mosi tuachane rasmi na matumizi ya mifuko hiyo,neutral
411,sw_train_00412,mbona ipo wazi tu policcm labda cha kurekebisha kidogo hapo ilitakiwa iwe nusu kwa nusu hiyo sa,neutral
412,sw_train_00413,hizi sheria zote zinatugusa kwa sasa kwa sababu sheria zinawahusu wananchi,neutral
413,sw_train_00414,je ni kweli wanawake wengi hawagombei vijijini kwa sababu hawana uchungu na changamoto mbalimbali zinazowakabili,neutral
414,sw_train_00415,baina ya mtu na moyo wakekama ilivyokuja kwenye aya hiyo hii ina maana kwambana kwa mujibu wa ufafanuzi uliotolewa na muhammad asad kutoka kwa imam raghibimola wetu mlezi mtukufu huingia baina ya matamanio ya mtu na matendo ya nje ambayo yanaweza kutokana na matamanio hayo,neutral
415,sw_train_00416,nini chanzo au vyanzo vinavykukosekana kwa uaminifu katika maisha ya ndoa karibu tujadili pamoja na omary,neutral
416,sw_train_00417,dogo alivyoumwa akalazwa ikahitajika kama hela ya matibabu nikiwacheck washikaji naambulia story ni,neutral
417,sw_train_00418,amna mzee baba ni mchakato mrefu saana uezi ukasema mwez tu unatosha watu kuelimika km wamemua kutokuzuia lockdown na mipaka basi isambazwe elimu ya kutisha saaaana saaana kila mahali namna ya kujikingabado watu wa,neutral
418,sw_train_00419,ahsante kwa mrejesho na endelea kufurahia huduma zetulm,neutral
419,sw_train_00420,hatuwapaishi tunasema nowhere to go kuna siku utaelewa,neutral
420,sw_train_00421,ubinadamu kazi isiyokuwa na malipo,neutral
421,sw_train_00422,jumanne siku ya kimataifa ya sanaa za kuandaa kupika na kula chakula kizuri kwa njia endelevu inakupa vidokezo vya kupunguza utupaji vyakula na kujiunga na harakati za,neutral
422,sw_train_00423,hii ilikuwa kazi yangu ya kwanza baada ya kumaliza form project ya kutoa chanjo ya kuzuia kansa ya shingo ya kizazi nikachaguliwa kwenda chuo wale wazungu wakaningangania nimalize project watanisomeshahome wakakataawaga nawamaindi ningekuwa twita kizungu sahivi,neutral
423,sw_train_00424,retweet weka handle yako follow wote walio like handle yako na wao wafollow back ni mda wa kukuza account,neutral
424,sw_train_00425,nimemsikiliza huyo taahira kweli kama hawa ndio wanategemea kua viongozi nchi hii haitaendelea anasema uhu,neutral
425,sw_train_00426,habari ahsante kwa kuwasiliana nasi pole sana tunaomba ufafanuzi wa tatizo lako tafadhali mnapata changamoto ganifb,neutral
426,sw_train_00427,hope ni huku kazimzumbwi mwanzoni before njiapanda ya jeshi kwenye lami mpyaa dc,neutral
427,sw_train_00428,adeo tunaomba kufahamu unapowasha data kwenye simu yako unapata alama gani eggh au g,neutral
428,sw_train_00429,kabla ujameza p hakikisha ulikuwa haupo katika dozi ya dawa baadhi ya dawa zinaweza kuizuia isifanye kazi kwa ufanisi mfano wa dawa ni kama zifuatavyo dawa zinazotumika kutibu kifafa mfano barbuturates primidone phenytoin and carbamazepine,neutral
429,sw_train_00430,kuna watu wanashindwa kuoa kisa hawana maharini heshima ila kama mtu hana wampe tu bure,neutral
430,sw_train_00431,kwani chama hakina pesa mpk useme hivo serikal na chama wanashare account kwani,neutral
431,sw_train_00432,nami nawapatiliza wana maovu ya baba zao hata kizazi cha tatu na cha nne cha wanichuki,neutral
432,sw_train_00433,mwenendo wa wastani wa pato la taifa kwa mtu mmoja mmoja gdp per capita kwa mikoa bora kuanzia mwaka ,neutral
433,sw_train_00434,matendo ya wakati husika ni kielelezo cha wakati ujao,neutral
434,sw_train_00435,oyaaa pokea simu,neutral
435,sw_train_00436,aidha amesema nmb inafanya kazi pamoja na wilaya na halmashauri zote nchini ikiwa ni pamoja na kutoa mikopo rafiki kwa wafanyakazi wa serikali,neutral
436,sw_train_00437,lazima tu utakuwa na pesa nyingine pemben ya kubadilisha diet njeya hiom pesaya kubadilisha mboga,neutral
437,sw_train_00438,kuna siku tulikuwa na mjadala humu nikashauri masomo ya watoto yangekuwa yanaanza saa ukowataalamu wakasema sijui kuamka asubuhi inawasaidia nini nini kiafya,neutral
438,sw_train_00439,ametokea wapi mtoto wa muamar gaddafi aliyedhaniwa kufariki ajitokeza na kutaka kuiongoza libya,neutral
439,sw_train_00440,jifunze kubaki kimya kuliko kuongea vitu usivyokuwa na uhakika navyo,neutral
440,sw_train_00441,rais wa uganda yoweli museveni amemuandikia barua spika wa bunge la uganda rebecca kadaga baada ya kusitisha utiaji saini wa mswada wa teknologia ya mbegu za kibiologiagmo na kurejesha mswada huo bungeni kwa ajili ya kujadiliwa upya,neutral
441,sw_train_00442,yaliyomo kwenye gazeti la uhuru leo alhamisi novemba habari za kitaifa kimataifa michezo makala jipatie nakala yako kwa tsh ,neutral
442,sw_train_00443,hii ni changamoto tusikate tamaa kulitolea ufafanuzi na tuhimize wanawake kugombea pia nafasi za wote,neutral
443,sw_train_00444,masauni azindua mpango wa kusaidia wakimbizi,neutral
444,sw_train_00445,zao la chai lina fursa ya kuinua uchumi hapa nchini ya wakurugenzi wa wakala wakulima wadogowadogo wa zao hilo http,neutral
445,sw_train_00446,kwenye leo dodoma wana azaki wakiwa katika matembezi kuelekea ukumbi wa jakaya kikwete kwenye shughuli nz,neutral
446,sw_train_00447,unaweza badilisha muonekano wa eneo lako na taa hizi za pembeni karibuni ndugu zangu,neutral
447,sw_train_00448,mkuu wa wilaya ya kisarawe mhe atembelea ofisi makao makuu katika ziara hiyo mhe jokate ameliomba,neutral
448,sw_train_00449,unaomba mungu awaue adui zako wakati maandiko yanasema anaandaa meza machoni pa watesi wako watesi wamekufa mungu ataandaa meza ya nini sasa,neutral
449,sw_train_00450,tarehe katika maonyesho ya kutakuwa na mijadala mbalimbali itakayowakutanisha azaki pamoja na wadau,neutral
450,sw_train_00451,naomba kuuliza taratibu za kufuata na wapi ambako naweza kusajili au kupata kibali cha kurusha drone camera au kupata mt,neutral
451,sw_train_00452,leo mei ni siku ya umoja wa mataifa ya kimataifa ya kutokomeza fistula ya uzazi kauli mbiu inasema fistula ni u,neutral
452,sw_train_00453,watu wameondolewa kisa wana vyeti feki bila uthibitisho nadhani wananchi sasa hivi wameanza kuelewa kwanini tulitaka k,neutral
453,sw_train_00454,watoto tunawa underestimate sana kwenye uwezo wa kiakili watoto ni wadadisi kuliko watu wazima watoto ni risk takers ku,neutral
454,sw_train_00455,sisi watanzania tumeamua lililokuwa daraja la miti na kamba ambalo lilikuwa likiunganisha wananchi wa mkoa wa rukwa n,neutral
455,sw_train_00456,namna ya kutengeneza pesa mtandaoni ungana nasi kesho kwenye jukwaa la kuanzia saa asbh upa,neutral
456,sw_train_00457,rais magufuli azindua rasmi programu ya pili ya maendeleo ya kilimo nchini asdp ,neutral
457,sw_train_00458,tanzania kuna watu milioni weka watu milioni wanaoku milo miwili kwa siku zaidi ya sahani milioni ,neutral
458,sw_train_00459,habari pole kwa usumbufu uliojitokeza kuna tatizo la kiufundi kwa upande wa tigopesa na wataalam wetu wanafanya jitihada za kutatua tatizo hilo mapema iwezekanavyo tafadhali jaribu tena baadae,neutral
459,sw_train_00460,habari kama umesahau namba yako ya siri naomba utembelee atm ya nmb iliyo karibu na wewe ili uweze kujitumia namba ya siri mpyayn,neutral
460,sw_train_00461,eehsema sista alikuwa anatuwekea msosi kwa siri getosema ndo tunakuta umepoa kinoma,neutral
461,sw_train_00462,leo saa mchana live on live upendo fm radio dsalaam tutakuwa na tukizungumzia umuhimu wa kijana,neutral
462,sw_train_00463,umeona wapi bonasi ya za dakika na mpaka gb za data ukijiunga na kifurushi cha bonga au mpakabasi cha siku au wiki kutoka zantel utapata bonasi hii kwa maelezo zaidi bofya,neutral
463,sw_train_00464,naibu waziri wa mambo ya ndani ya nchi mhandisi hamad masauni amewataka watanzania kuweka fedha zao katika benki za kiislamu zilizopo nchini ambazo hazina riba ili ziwasaidie katika mafanikio mbalimbali,neutral
464,sw_train_00465,uko sahihi sanaunaweza ukaua ratiba zako ili ufanikishe la mtu aliyembali ila siku ukisema siwezi nimeb,neutral
465,sw_train_00466,jana aubameyang alikuwa na odds leo kama una hela unataka kuzalisha mpe lewandoski na haaland frame ods,neutral
466,sw_train_00467,one branch network ni mfumo unaoruhusu kufanya miamala ya papo kwa papokwenda matawi yote ya katika,neutral
467,sw_train_00468,abaya in stock kwa tu ipo pia rangi ya pink maroon mustard yellow na royal blue nafanya delivery na mikoani natum,neutral
468,sw_train_00469,ahsante kwa kutembelea ukurasa wetu zantel mtandao nafuu zaidi nchini,neutral
469,sw_train_00470,namba yako ya simu duka ulipowasilisha taarifa zako kwa msaada zaidi ahsante oe,neutral
470,sw_train_00471,tutafanyia kazi kubadili vifurushi hivyoka,neutral
471,sw_train_00472,hawa jamaa kazi yako sio ya kitoto aiseee cheki mchuma ulivyo kuwa kabla na baada wanapatikana mitaa ha si,neutral
472,sw_train_00473,hakuna atakae hustle badala yako,neutral
473,sw_train_00474,npe darsa kidogo darasa ninalolijua mimi ni kuwa ukijifukiza unaeza athir mfumo wako wa upumuaji npe darasa,neutral
474,sw_train_00475,weekend kama hii huna haja ya kubeba cash lipia bili zako kwa urahisi na equity jipatie kadi yako sasa,neutral
475,sw_train_00476,tumeamua kupeleka madaktari katika vituo vya afya tofauti na ilivyokuwa hapo awali madaktari walikuwa kweny,neutral
476,sw_train_00477,hii paypal bhana nilipewa story wao ndo hawajalielewa soko la tzsijui shida ni nini,neutral
477,sw_train_00478,un taarifa za kupotosha kuhusu chanjo zinarefusha tatizo umoja wa mataifaun umetoa wito kwa raia kuhakiki taarifa kuhu,neutral
478,sw_train_00479,habari ya mjini ndio hii fanya booking yako mapema kupata punguzo la bei,neutral
479,sw_train_00480,rich habaritunapenda kukujulisha kwamba tumefanya maboresho kwa kutumia menyu yako au bado unaweza kufurahia vifurushi vya intanet kama vile social pack na vifurushi vya video,neutral
480,sw_train_00481,luhaga mpina awaonya wanaokwamisha wafanyabiashara na mawakala wa uuzaji wa samaki kufanya migomosoma zaidi gtgt,neutral
481,sw_train_00482,changia faini ya viongozi wa chadema mpesa kwenda crdb bonyeza tuma pesa kwenda benki chagua crdb,neutral
482,sw_train_00483,mimi siamini kua kuna mtu mvivu hakuna mtu anaeupenda umasikini kinachotengeneza uvivu ni mfumo mbovu,neutral
483,sw_train_00484,ndio una jezi ya euro wewe haya mateso ni ya muda mrefu sana,neutral
484,sw_train_00485,nimekwenda hosipitali daktari wamesema dawa yangu ni wewe we ndio wangu daktari cc,neutral
485,sw_train_00486,habari ahsante kwa uvumilivu wako pole sana kwa changamoto uliyoipata huduma ya internet sasa imerejea tunaendelea kuomba radhi kwa usumbufu uliopata vodacom tunaahidi kufidia mb zako ulizopoteza kuanzia leo asubuhi ahsantenm,neutral
486,sw_train_00487,zali la mentali ndivyo sivyo hapo vipi kipi sijaskia tatu chafu,neutral
487,sw_train_00488,bro ananambia kila mwaka lazima aende na familia nje kuenjoiye anaita kula pipi sahivi kaishakata hadi tiketi wanaondoka tardec kwenda uturuki for days,neutral
488,sw_train_00489,sina chama sina kadi but napenda nchi yangu ndio mana nimechanga huu nimchango dhidi ya udhalimu na uonevu,neutral
489,sw_train_00490,utumishi wa umma ni kazi ya si pahali pa kujilipa mamilioni mwalimu julius k nyerere,neutral
490,sw_train_00491,sana yaani kwani wale huduma hiyo hawana kweli,neutral
491,sw_train_00492,je wajua binadamu mwenye kilo ana lita za maji katika mwili wake lita ndani ya cell na lita nje ya cell,neutral
492,sw_train_00493,miongoni mwa mtihani mkubwa sana kwa vijana ni ibada kama upo kwenye hili kundi na bado unajitahidi ibada zisikupite hon,neutral
493,sw_train_00494,yajue haya kumi kuhusu mmiliki wa bidhaa za apple steve jobs steve alizaliwa mwaka na kufariki october,neutral
494,sw_train_00495,mahaba teleeee kwenu,neutral
495,sw_train_00496,tumepokea kwa hatua zaidi,neutral
496,sw_train_00497,mimi nilikiwa na bphysics achemistry na abiologywakati huo huo nina bhistory akiswahili na aenglish nikaamua kwen,neutral
497,sw_train_00498, mwanadada aliyekuwa ndiye mc wa shuguli ya usiku wa katika ukumbi wa mlimani city ji,neutral
498,sw_train_00499,ole sabaya tayari sheria ishachkua mkondo wake bado ndgu yake ole gunner maaana nae c muelewi,neutral
499,sw_train_00500,pole kwa usumbufu pesa yako imeshafanyiwa kazi jumatatu pesa itarejeshwa kwenye akaunti yakojj,neutral
500,sw_train_00501,ndugu yangu tuna vyuo sasa ph holders wenyewe wanatafuta teuzi za udc wakashindane na wenye diplo,neutral
501,sw_train_00502,zipo changamoto wanazokutana nazo polisi wakiwa katika patro zao je unajua ni changamoto zipi live pd police patrol ni makala inayokuonyesha matukio mbalimbali wanayokutana nayo polisi katika kazi zap tazama makala hii kila alhamis saa usiku kupitia channel ci ,neutral
502,sw_train_00503,kwa namna yoyote kama hujawahi kula bata bills sijui utahadithia nini wala bata wenzako,neutral
503,sw_train_00504,ndoa zote ni mtihani kinachotofautisha hali ya ndoa moja na ingine ni jitihada na kudra za watahiniwa,neutral
504,sw_train_00505,na wale wanaotajiwa bbmahari kubwa wanakuwa hawana na wazazi hawapunguzi bei kama supermarket inakuwaje,neutral
505,sw_train_00506,kuna shida gani kusafiri kitajiri kwa bei poa unahitaji tuu mambo yasiwe mengi,neutral
506,sw_train_00507,pole sana kwa changamotohalafu namba utufahamishe mahali ulipo,neutral
507,sw_train_00508,jeshi la magereza limeendelea na program za urekebishaji wafungwa kupitia viwanda vidogo vidogo kuwapatia stadi za kazi,neutral
508,sw_train_00509,waziri wa mambo ya ndani wa fred matiangi ameagiza kuondolewa nchini humo na kurudishwa kwao raia wanne wa china,neutral
509,sw_train_00510,unakwama wapi kishiriki alafu gharama ya usajili ni ndogo sana before oct ila baada ya h,neutral
510,sw_train_00511,wanaume wengi huwa tunabeza sana haya mambo ya kujiunga kwenye vikundi vidogo vidogo vya kijamii ambavyo vingi malengo yake h,neutral
511,sw_train_00512,tafadhali tujulishe tatizo lako kwa msaada zaidijb,neutral
512,sw_train_00513,mnawezaje kupata mtoto wa kiume ili kuongeza uwezekano wa kupata mtoto wa kiume wenzi wanapaswa kula vyakula kama mihogo m,neutral
513,sw_train_00514,tunaomba namba yako dm kwa msaada zaidi,neutral
514,sw_train_00515,mkuu wa mkoa wa rukwa afanya ziara na kukagua maendeleo ya ukarabati wa chuo kikuu cha sayansi na teknolojia tawi la rukwa nakuwahamasisha wanafunzi wasome masomo ya sayansisoma zaidi gtgt,neutral
515,sw_train_00516,kuna changamoto nyingi zinazo wakumba walimu na ufundishaji ambapo tumekuwa tukijitahidi kukaa na serikali wadau mbalimbali,neutral
516,sw_train_00517,biashara asubuhi jioni mahesabu ya madrid jana yasitukatishe tamaa mapema tu ingia premier bet utengeneze pesa mi,neutral
517,sw_train_00518,interest zinatofautiana kulingana na aina ya akaunti na kiwango cha kuweka kupitia akaunti ya akiba ni shilingi jb,neutral
518,sw_train_00519,ilee pilipili yetu pendwa yenye ladha murua kabisa kwenye chakula chako washwa na g mchongo bado upo mtaani kwa wakazi wa,neutral
519,sw_train_00520,wenye siri za hawa wake wengine pembeni na familia kwa ujumla ni wazazi wetu wa kiume or kike mchongo kwao huwa unafaha,neutral
520,sw_train_00521,fahamu kuwa michezo ya wwe raw inaonyeshwa kupitia chaneli namba ss kifurushi cha dstv bomba tshs saa saa usiku,neutral
521,sw_train_00522,ndiyo anaweza kupata iwapo mshahara wake uliobaki ni na kuendeleatl,neutral
522,sw_train_00523,sio kila mpenzi wako anapokuomba hela umpe fasta hata kama unayosiku nyingine mwambie sina ngoja nikutafutie ili ajue hela zinatafutwa sio zipo tu,neutral
523,sw_train_00524,mkubwa hasemwi mkubwa anaelekezwa,neutral
524,sw_train_00525,na wakristo wengi wanao zaidi ya mmoja sema hawana nguvu ya kuhalalisha watu wanakompromaizi amani ya mioyo yao kwa kigezo,neutral
525,sw_train_00526,watag tuwainfluence sasa,neutral
526,sw_train_00527,bro kama ile kauli ya cag hujaielewa biblia ilivyo na mafumbo unaielewa kweli,neutral
527,sw_train_00528,chapati supu na soda billi imekuja na mfukoni nina elfu nifanyaje ndugu zangu,neutral
528,sw_train_00529,hili jambo sio dogo kama tunavyofikiriahii elimu ya kiingereza tu bado hatuna soko kwenye ushindani wa ajirando ije iyo ya kiswahili,neutral
529,sw_train_00530,wadau mbalimbali wa takwimu kutoka taasisi za utafiti wamekutana jijini nairobi kwenye mkutano wa unaolenga matumizi ya takwimu na miundombinu katika kutatua changamoto zilizopo kwenye sekta ya kilimo duniani mkutano huo umeandaliwa na taasisi cgiar,neutral
530,sw_train_00531,rais magufuli aitaka bot kudhibiti matumizi ya fedha za kigeni nchini,neutral
531,sw_train_00532,daktari wa manesi usimlipe hela hiyo mimi nina mmudu vizuri sana kwanza hatutufanyia kishikaji tu,neutral
532,sw_train_00533,wazee wa kunyoosha bodi za magari chuma inatoka kama mpya check nao wanapatikana sinza mapambano kindly r,neutral
533,sw_train_00534,nguvu za kiume na tikiti maji tikiti maji ni tunda ambalo kitaalamu tunaliita citrullus lanatus,neutral
534,sw_train_00535,zifuatazo ni kurasa rasmi za kwa ajili ya kupata taarifa mbalimbali za hali ya hewa f tanzania meteorolo,neutral
535,sw_train_00536,orest ngowi msanii wa bongo flava ruby amefunguka kuhusu kufa,neutral
536,sw_train_00537,taarifa za wasichana kupoteza masomo kwa sababu ya mimba zinaripotiwa kwenye vyombo vya habari na zipo zisizojulikana w,neutral
537,sw_train_00538,habari ukifika dukani kwetu ni gharama yake ni shilingi ka,neutral
538,sw_train_00539,kesho saa jioni kwenye utasikia mapinduzi ya muziki unaopigwa live kupitia yako ,neutral
539,sw_train_00540,corona huambukizwa kwa njia ya hewa kwa kuingiwa na majimaji yenye virusi kutoka mtu mmoja kwa njia ya kukohoa au kupig,neutral
540,sw_train_00541,taasisi zinahitaji kujiuliza zinataka page za mitandao ya kijamii ziwe kwa ajili gani unaweza kutumia mitandao ya kija,neutral
541,sw_train_00542,habari emanuel ahsante kwa kuwasiliana nasi naomba nikufahamishe kuwa tulikuwa na tatizo la kimtandao kwenye upande wa intanet mafundi wetu wamelifanyia kazi na sasa huduma ipo sawa tunaomba radhi kwa usumbufu uliyojitokeza sc,neutral
542,sw_train_00543,wako hapa ni imani yetu watakujibu,neutral
543,sw_train_00544,habari tafadhali tutumie namba ya simu husika kwenye inbox dm ukiambatanisha na maelezo yote yanayounga mkono tatizo lako ili tuweze kufanya uchunguzi kwa ajili yako unaweza kututumia namba ya simu husika hapa asante zm,neutral
544,sw_train_00545,mtu anae tafuta mafanikio au aliefanikiwa hulalasleep less kidogo ndio moja ya uwekezaji mzuri zaidi unaweza kufanya ili maisha yako yawe na tija na yenye thawabu,neutral
545,sw_train_00546,mida hii kwenye xxl clouds fm radio live mandojo na domokaya wakiireview album yao ya taswira,neutral
546,sw_train_00547,jama tuhamasishe watuvwazifollow acount za club yetu iwe twiter ama insta wenzetu simba wanatutambia pesa hata,neutral
547,sw_train_00548,pole sana kwa changamototunaomba utupatie namba yako yako simu na mahali ulipo tufuatilie tafadhali,neutral
548,sw_train_00549,listi ya warembo watoto wa marais afrika,neutral
549,sw_train_00550,pole sana kwa hilo ili uweze kuona mkeka wako wa nyuma unatakiwa kurudisha tarehe nyuma kwenye bet history yako ss,neutral
550,sw_train_00551,njia ya kukuza twitter account yako from followers in days fahamu malengo ya account elezea malengo ya ac,neutral
551,sw_train_00552,habari pole kwa hilo tumewasiliana na wewe tunasubiri mrejesho dminbox pa,neutral
552,sw_train_00553,na mwanangu juzi kangoa nikamuuliza hivi unatumiaga hata kondomukanijibu kirahisi kabisahapana sio ujanja mjue wanangu ukimwi upo,neutral
553,sw_train_00554,tangazo la kikao cha watengenezajiwaagizajiwasambazaji na wadau wote wa bidhaa za nondo tarehe ,neutral
554,sw_train_00555,utoaji wa mimba matumizi ya njia za kudhibiti mimba dawa za kulevya na mafarakano katika ndoa yametajwa kuwa baadhi ya matendo ambayo watu wanayashabikia bila kujua kuwa wanatenda dhambi,neutral
555,sw_train_00556,kuna fursa inaitwa stawi lab mafunzo kwa ajili ya taasisi za vijana zinazojikita kutetea haki za wasichana na wanawake,neutral
556,sw_train_00557,haya mc naomba uwalete fans dondosha handle yako retweet na likeucsahau kufollow back,neutral
557,sw_train_00558,lakini matokeo ya jitihada hizo kuboresha viwanja vya ndege yameanza kuonekana ndugu zangu hivi majuzi mmeshuhudia ndege kubwa aina ya boeing dreamliner ya shirika la klm ikitua kwenye uwanja wetu wa,neutral
558,sw_train_00559,shirika la umeme tanzaniatanesco taarifa ya maboresho ya miundombinu ya umeme shirika la umeme tanzania,neutral
559,sw_train_00560,wameambiwa na mwenyekiti wao kila kitu ni sawa hata kama hakiko sawa ndio maana mteuliwa wake akitangaza kuna dengu wakati kw,neutral
