,ID,tweet,label
754,sw_train_00755,tunapenda kukufahamisha kuwa unaweza pia kutoa taarifa kwenye mitandao yetu ya kijamii au kutumia simu au kutuandikia barua pepe kupitia tuambiecom au hudumakwawateja na tukakupatia huduma bila kufika tawini na kuj,neutral
755,sw_train_00756,mh makamu wa rais wabunge wa viti maalumu mkoa wa pwani hatuko nyuma tunatoa magodoro na tenki la maji kama mchango,neutral
756,sw_train_00757,habari ili uweze kupata ofa hii ni lazima utumiwe ujumbe katika simu yako na ujiunge ndani ya masaa toka ulivyopokea ujumbe,neutral
757,sw_train_00758,kama mvuvi anavovua samaki huwema chambo ili anase bila chambo samaki ata nasa natumain umelewa kwa kina,neutral
758,sw_train_00759,me hata mkinichukia ila sitoacha kuwakumbusha kuvaa jezi mda wa mechi,neutral
759,sw_train_00760,pamoja sana endelea kufurahia huduma zetuka,neutral
760,sw_train_00761,kuna li bro moja tuko nalo huku ununio kwanza lina hela halafu linaipenda kinoma familia yake once in a month lazima w,neutral
761,sw_train_00762,watu wa arusha unaweza ukawakuta kwenye normal convo tu ukahisi wanagombanau guys mna hasira mda wote,neutral
762,sw_train_00763,je unamiliki gari namba d uko na dharura kifedha karibu platinum credit tunatoa huduma za mkopo wa pesa kwa,neutral
763,sw_train_00764,lakini ukimuelekeza ye mwenyewe anajua huu ni upuuziakiona tu anabadili channelkama we unavyobadili ukiona kipindi cha mapishi,neutral
764,sw_train_00765,soma tathmini hii ya wataalamu wa lishe,neutral
765,sw_train_00766,ushindi wa dhidi ya sheffield united imekamilisha safari ya kutopoteza mchezo wa ligi kwa mwaka mzima mar,neutral
766,sw_train_00767,una order viwanda sio vyako private sector imejaa wagenimchana mwema broila mkiweza badilisheni,neutral
767,sw_train_00768,pole sanatafadhali tufahamishe tatizo lako mteja wetu,neutral
768,sw_train_00769,tuma hapa hapa au dm,neutral
769,sw_train_00770,ndo kwanza nipo kanyagi kadogo nasubiria msosi wa shemeji ako nimpelekenishaacha uhuni narudi home mapema sahivi,neutral
770,sw_train_00771,katibu mkuu wa na mbunge wa kibamba mh namwombea apate nafasi tena mbele ya magufuli ili aongee te,neutral
771,sw_train_00772,dunia imebadilika sasa hivi study nyingi zimeonyesha kuwa watu kujipima wenyewe inapu,neutral
772,sw_train_00773,laini za ttcl ni bure weka kianzio cha sh na kuendelea ili kuanza kutumia laini yako huduma za ttcl corporation,neutral
773,sw_train_00774,nisamehe babyntawapa na nyinginenimeanza na hii tu coz ilinishangazame siwezi ujue,neutral
774,sw_train_00775,pole sana ndugu mteja huko leo kuna maboresho ya miundombinu pole sana inaonekana tangazo halikufika kwa wakati,neutral
775,sw_train_00776,mwana kakwama anapush ndinga yake bei ya kiserikali kabisa yupo mwanza bei m cc yaani mafuta ya buku unafuata mtoto mzuri mahali mcheki hapa o,neutral
776,sw_train_00777,today in tarime minister launched a campaign mimi msichana najitambua elimu ndio mpango mzima,neutral
777,sw_train_00778,k views in days tunawashukuru sana raia wa kidijitali na tuendelee kufuatilia cc,neutral
778,sw_train_00779,kaduma habari karibu katika kurasa zetu tafadhali tembelea kwenye ofisi zetu kwa msaada zaidi,neutral
779,sw_train_00780,matukio katika picha kuelekea wiki ya azaki dodoma,neutral
780,sw_train_00781,mtoto mama nimemuomba baba hela ya kusuka akaninyoa nywele mama shukuru mungu mwananguungemuomba pesa ya whitedent angekungoa meno,neutral
781,sw_train_00782,waziriwhusm mhedkt harrison mwakyembe akiwa katika picha ya pamoja na watendaji wa tbc mara baada ya kukamilisha ziara yake,neutral
782,sw_train_00783,lubasha nakubaliana na wewe ila sometime huyo uneyemfanyia ubinadamu atatoka na kusema kwa mtu aah hii k,neutral
783,sw_train_00784,samahn kidogo mnaojua masuala ya uchumi kidogo naomba msaada naomba kujua maana ya maneno ya fuatayo stable outlook negative outlook b b b up arrow down arrow,neutral
784,sw_train_00785,sio nchi nzima ni eneo lako mbeya sehemu gani na namba ya simu,neutral
785,sw_train_00786,na wanakukaribisha kwenye ya kuanzia sasa hadi saa sita kamili,neutral
786,sw_train_00787,je wewe ni muwekezaji kwenye kilimo biashara na unataka kujifunza mbinu za masoko kwa ajili ya bidhaa zako karibu,neutral
787,sw_train_00788,kama jambo hili linakubalika kwa wote mliohudhuria hapa mimi kama spika lazima niwahoji mhe job ndugai spika wa bunge tanzania,neutral
788,sw_train_00789,jamani kila kitu kinaongozwa kwa misingi ya katiba naomba japo kifungu cha sheria kinachosema kumsifia mwanamke ni sawa na umemdhalilisha,neutral
789,sw_train_00790,naona watu wenye muamuko mkubwa kama i hope hao watawesa toa suppo kwa content ako sometimes inakubid ata uwa tag unaweza mute notificationlkn ujumbe ufike kwa watu husika unajua twitter kunawasomi,neutral
790,sw_train_00791,waziri wa afya akikagua neti ya mmoja wa mama aliyejifungua hospitali ya rufaa ya mkoa wa mtwara ligula,neutral
791,sw_train_00792,kumbukumbu hizi zitunzwe hata wanaotuzomea leo watazihitaji kesho akili na utu vitakapowarudia,neutral
792,sw_train_00793,shaka ondoa tupo vizuri na tunazidi kuimarika kwa maeneo ambayo miradi yetu imekamilika wateja wetu wana enjoy sana kwa maeneo ambayo kazi zinaendelea tunaomba subira yenu,neutral
793,sw_train_00794,prof baregu miaka ya ujinga umasikini na hofu vilikuwa maadui wa lakini kwasasa ujinga umasikini na h,neutral
794,sw_train_00795,haki itendeke sheria ifuate mkondo msichana apatiwe matibabu ya kisaikolojia kisha,neutral
795,sw_train_00796,mungu anakuona wa nay,neutral
796,sw_train_00797,naomba kusema wazi kuwa hedhi si jambo la ziada ambalo mwanamke anajiamulia iwe sehemu ya maisha yake au l,neutral
797,sw_train_00798,mwenyekiti wa bavichatunataka tume huru ili atakaeshinda atangazwe tunataka tume huru ili tuepushe gharama ya kumwaga damu,neutral
798,sw_train_00799,miongoni mwa kero ambazo nilizipokea kipindi cha kampeni wananchi wengi walilalmikia ucheleweshaji wa kesi kukithiri,neutral
799,sw_train_00800,madaktari wanasema watu wanaozaliwa na ugonjwa huu muscular dystrophy syndrome haswa wanaoupata wakiwa na umri mdogo wanaishi miaka kumi mpaka mwanzoni mwa miaka ya lakini nasema allah anajua zaidi hadi wakati sahihi utakapofika,neutral
800,sw_train_00801,ushapata mwaliko ktk wiki hii ya customer service pale tbl eti amp na,neutral
801,sw_train_00802,uhuru michezoaliyekuwa nahodha wa klabu ya liverpool steven gerrard amezungumzia juu ya nia yake ya kurudi anfield akiwa kama kocha wa klabu hiyo,neutral
802,sw_train_00803,aminaasante ni kweli tunaboresha poleni kwa changamoto zilizojitokeza,neutral
803,sw_train_00804,sasa hapo ule vyote vya baridi au kimoja wapo ndo utackia radha mujarabu maana viporo vyote makini lkn asa cha maharage,neutral
804,sw_train_00805,singoshine tafadhali fahamu namba ya dikoda yako ni salim,neutral
805,sw_train_00806,kila baada ya miaka tunapata wabunge wapya na unakuta hawana uelewa wa kutosha katika sekta ya madinikwahiyo tunahitaji azaki ziendelee kutoa elimu na kufanya uchechemuzi sekta ya uziduaji jesca kishoa mjumbe kamati ya nishati na madini,neutral
806,sw_train_00807,zipo zaidi ya hekari milioni moja na laki moja kwa ajili ya kilimo mkoa wa kagera una zaidi ya maeneo yenye ukubwa za,neutral
807,sw_train_00808,kabisa mzee tumekua kwa ratiba hizo na tumetoboa fresh tu tv yes ila kwa muda na vipindi maalumu tena dingi nik,neutral
808,sw_train_00809,this friday kwenye with heavyweight mc mbunge wa binadamu na wanyama hapa,neutral
809,sw_train_00810,nchini uganda baadhi ya tamadunibinti akipata hedhi ya kwanza inayofuata lazima awe ameondoka na kuolewa hii ni tam,neutral
810,sw_train_00811,wakati bado unajadiliana na halmashauri ya kichwa chako juu ya kuchanja au kutochanja basi endelea kujikinga kwa kufuata tara,neutral
811,sw_train_00812,goes too hard on coco hadi nikamuonea huruma also nimependa jinsi alivyomlipia mil na mara zote ha,neutral
812,sw_train_00813,siku hizi ufunguo wa maisha sio elimu tena ni connection na undugulazition,neutral
813,sw_train_00814,uhuru michezouhuru digital inawatakila kila la heri klabu ya kwenye mchezo wake wa leo dhidi ya as vita club ligi ya mabingwa afrika huko mjini kinshasa nchini kongo,neutral
814,sw_train_00815,kwa mwezi mzima bila gharama za ziadayaani ukilipia kifurushi cha dstv bomba utapata kifurushi cha dstv familyfamily utapata compact,neutral
815,sw_train_00816,wana twita naomba nisaidie kumtag mtu mmoja humu umpe taarifa nimeweka movie mpya youtube akapate burudani kidogo ya dakik,neutral
816,sw_train_00817,umasikini sio sifa,neutral
817,sw_train_00818,tunakaribisha wote wenye makala ya afya elimu teknolojia ajira historia nk na wanaotafuta sehemu ya kuyachapisha,neutral
818,sw_train_00819,nale ni dawa ya mimea inayotibu changamoto ya vidonda vya tumbo kwa kuponyesha michubuko kwenye kuta za tumbo na kuua bac,neutral
819,sw_train_00820,habari hauwezi kutoa pin ya laini ikihitaji pin weka ka,neutral
820,sw_train_00821,suprise ya kwenye harusi ya full video ipo tayari kwenye,neutral
821,sw_train_00822,je wajua mpaka mwanzoni mwa watumishi wa umma hususani walimu mishahara yao walikuwa wakipokelea dirishanikwenye of,neutral
822,sw_train_00823,mwanza ni mkoa uliongoza kwa wana kuvaa nguo mpya mpya muleba wanashika namba na arusha wanashika namba moja,neutral
823,sw_train_00824,uhuru michezoratiba ya michezo ya leo januari ligi kuu tanzania bara,neutral
824,sw_train_00825, rafiki mpya anakuwezesha kupata mpaka tshs kwa kufuata vigezo hivi anaweza kucheza mechi moja kwa soko la njia tatu na odds ziwe au zaidi katika mpira wa miguu anaweza weka bashiri yoyote ya mechi nyingi jenga b,neutral
825,sw_train_00826,inahitaji busara kusahauna hekma vinaweza kutokea vitu vikapelekea ukakumbuka jambo lililopita maumivu yakanza tena,neutral
826,sw_train_00827,mkurugenzi mtendaji wa benki ya equity t robe kiboti kesho saa tatu asubuhi atakuwa live katika akaunti zetu za inst,neutral
827,sw_train_00828,kulikuwa na haja gani ya flyover inayoepusha msongamano kuliko kujali hili bonde la kigogo jangwani na mkwaju,neutral
828,sw_train_00829,julius mwaiselage executive director orci,neutral
829,sw_train_00830,unaweza kutembelea au tv guide kupata orodha ya chaneli zetu kwa maelezo zaidi bahati,neutral
830,sw_train_00831,karibu sana kwenye mkururo wa,neutral
831,sw_train_00832,wakati mwingine ukichapwa unapoteza kabisa umakini wa darasani na bado mwalimu anaweza kukwambia baadae nione ndo kabisa,neutral
832,sw_train_00833,ushahidi unaonyesha kumsomesha msichana kunapunguza kiwango cha ndoa za utotoni ukatili wa kijinsia na kuboresha ukuaj,neutral
833,sw_train_00834,mambo muhimu ya kuzingatia kabla na wakati wa kuandika wasifukazi cv hakikisha cv yako inaendana na kazi un,neutral
834,sw_train_00835,fuatilia viwango vya ubadilishwaji wa fedha za kigeni in real time kupitia eazzyfx tembelea tovuti yetu hapa,neutral
835,sw_train_00836,ujenzi wa jengo la la abiria unatarajiwa kukamilika mei mwaka huu ambalo litakuwa na uwezo wa kuhudumia abiria m,neutral
836,sw_train_00837,huyu jamaa sijui atafika lini huku mbeya nina shauku ya kuonana naye uso kwa uso kuna swali nataka nimuulize,neutral
837,sw_train_00838,unahitajika kuwa na kipato zaidi ya tzs kwa mwezipj,neutral
838,sw_train_00839,wapwa zangu sinaga choyo mimi nawainua kwenye deals za hela sasa ili upate fursa ya kuwa influencer wa brands kubwa na,neutral
839,sw_train_00840,aibua maswali tata utekwaji wa wanaripoti,neutral
840,sw_train_00841,tanzania na misri zimetia saini mkataba wa ujenzi wa kuzalisha umeme katika bonde la mto rufiji na kushuhudiwa na rais john pombe magufuli na waziri mkuu wa misri mostafa madbouly soma zaidi gtgt,neutral
841,sw_train_00842,panda vyeo hata uwe ceo lakini kumbuka huo sio mwisho wa maisha yako unaweza kuwa ceo wa kampuni ya mtu lakini ni houseboy wa maisha yako,neutral
842,sw_train_00843,kuna sheria ya ulipaji kodiit depends na turnover ya mfanyabiasharakuna ushuru wanalipa ni kodi iyowanalipa hela ya usafina vitu vyote wanavyotumia kukaanga chips wakinunua kuna vat,neutral
843,sw_train_00844,habari ahsante kwa uvumilivu wako pole sana kwa changamoto uliyoipata huduma ya internet sasa imerejea tunaendelea kuomba radhi kwa usumbufu uliopata sm,neutral
844,sw_train_00845,hivi mwalimu unahisi me sikipendi kiswahiliau naona icho unachokitamani haiwezekani kesho wala kesho kutwawazo lako ni zuri na unajua,neutral
845,sw_train_00846,asanteni sana kwa kuungana nasi leo tunathamini sana uwepo wenu na tunaahidi kufanyia kazi maoni na ushauri wenu mliotup,neutral
846,sw_train_00847,leo ntakoma,neutral
847,sw_train_00848,kifo hakisababishwi na mwanadamu everything is god plan waeza umwa miaka kenda na usife hakuna wakulaumiwa au kapigwa risasi c ugojwa tu,neutral
848,sw_train_00849,sawa tumezipokea,neutral
849,sw_train_00850,shirika la afya duniani limesema kuwa uvutaji wa sigara unabaki kuwa chanzo kikuu cha vifo ambavyo vingeepukika licha ya kupungua kwa matumizi ya sigara duniani tangu kuanza kwa karne ya ,neutral
850,sw_train_00851,utabiri wa hali ya hewa wa saa zijazo kuanzia saa usiku wa leo kama unavyoletwa kwenu na mchambuzi joyce,neutral
851,sw_train_00852,baada ya ushindi wa epl wiki iliyoisha man city wanakutana na oxford united katika je vijana guardiola wataweza kuchomoka na kutinga nusu fainali shuhudia mechi hii kesho saa usiku kupitia ss kwa kulipia kifurushi cha compact plus ,neutral
852,sw_train_00853,kama kuna mtu anafahamu jina la movie hii naomba anisaidie,neutral
853,sw_train_00854,hii ni sehemu ya mwisho ya stori ya bi scolastika ngwaluesoni mshindi wa tsh ambapo anaweka bayana mipango yake soma usisahau wiki hii jackpot inasoma tsh ,neutral
854,sw_train_00855,tamko kupinga adhabu za kikatili shuleni,neutral
855,sw_train_00856,mwaisa vs mtu mrefu photographer by me,neutral
856,sw_train_00857,ukitaka mwizi asikuibie mpe nafasi ya kua mtunzaji wa pesa zakohawa ccm wana kasi ya ajabunadhan n,neutral
857,sw_train_00858,unamuacha lini huyu sasaaaaa kuna watu huko wanaitwa beach wanasubiri coco muwe kimoja achan,neutral
858,sw_train_00859,are you invited kwenye listening pay ya msanii nitawasimulia hapa hapa ukali wa ngoma zilozopo kwenye,neutral
859,sw_train_00860,cpwaa mungu amlaze mahali panapostahili jamaa alikuwa anaimba sana nakumbuka ile nyimbo ya action ft alb,neutral
860,sw_train_00861,japan wanafanyakazi usiku na mchana ili kuweza kugundua technology maalumu ambayo nyumba inaeeza kutoka ardhini hii ni kwa ajili ya kujikinga na madhara ya tetemeko,neutral
861,sw_train_00862,mchawi stock ya chakula tubut km una stock yako ya msosi hio ngoma jion,neutral
862,sw_train_00863,first date unampeleka club unamnunulia pombe baada ya kulewa anaanza kulia huku anasema naomba unipeleke nyumbani kwa,neutral
863,sw_train_00864,kwa mujibu wa sheria ya nchi wachezaji wa kigeni ni lazima walipe kodi,neutral
864,sw_train_00865,wanasema mtu anaeongea na simu unaweza ukampa kitu chochote na akapokea kwa mkono wake ba asijue umempa kwa ajili gn kama unabisha jaribu,neutral
865,sw_train_00866,katika kuhakikisha tunakufikishia huduma zetu popote ulipo sasa tupo mtaani kwakouonapo gari yetu ya matangazo karibu uj,neutral
866,sw_train_00867,meneja wa programu na utafiti fadev evans rubara akiongea na balozi wa denmark nchini tanzaniam bi mette norgaard dissing,neutral
867,sw_train_00868,hii iwafikie kwa wale wote watafuta mafolowazi wenzangu chapa like chapa handle chapa retweet,neutral
868,sw_train_00869,ibara ya ya katiba inatamka wazi kila mtu anayo haki ya kuwa huru na kuishi kama mtu huru kufanya shughuli za k,neutral
869,sw_train_00870,kwa sasa sina mpango kugombea urais wa jamhuri ya muungano wa tanzania licha ya kwamba sifa zote za kikatiba zinazohitajika,neutral
870,sw_train_00871,kesho ni siku yetu ya kujifunza na kujua mbinu za kupata kazi kirahisi ndugu vijana na s,neutral
871,sw_train_00872,ndugu mteja kutumia laini ambayo haijasajiliwa kwa jina lako ni kosa la jinai piga huhakiki jina kama si sahihi fika dukani kwetu,neutral
872,sw_train_00873,na juhudi za kuusambaza zaidi maeneo mbali mbali zinaendelea ajira udereva uboharia uendeshaji mitambo na ufundi,neutral
873,sw_train_00874,chimbuko la upasuaji wa kumtoa mtoto tumboni kuokoa maisha afrika mashariki historia ya tiba inaonyesha falme za af,neutral
874,sw_train_00875,wake wawili labda nimpishe aingie yeye ufanye kwa magendo ukamfichie sijui wapi hio vita haitulizwi hata na umoja,neutral
875,sw_train_00876,maadili na kizazi kipya via,neutral
876,sw_train_00877,fika pinned ya fazoboya fanyeni uzungu wa retweet tweet ya ndani alafu muje na handle zenu wajomba,neutral
877,sw_train_00878,napenda kukanusha taarifa zinazosambaa mitandaoni kwamba katibu mkuu wa ccm komrade kinana atakuwa na mkutano na waandishi l,neutral
878,sw_train_00879,pole kwa usumbufu ulioupata tulikua tuna tatizo la kiufundi katika huduma ya intaneti tumerejesha kifurushi chako na tulifanikiwa kuongeza mb kulingana na kifurushi ulichokua umenunua sm,neutral
879,sw_train_00880,parody hilo linaupiga mwingi,neutral
880,sw_train_00881,baadhi ya wafanyakazi na wateja wa benki ya equity tanzania walipojumuika kwa pamoja katika uzinduzi wa maadhimisho ya wi,neutral
881,sw_train_00882,miaka kwanin alipaswa aninginizwe kwenye kamba ya katani sec afu wamshushe wamuweke tena sec afu,neutral
882,sw_train_00883,safari ya kwenda england,neutral
883,sw_train_00884,imenifikirisha sana hivi utafanya nini ukigundua ex wako ana picha zako za utupu,neutral
884,sw_train_00885,waziri wa afya akihitimisha majumuisho ya makadirio ya bajeti ya wizara hiyo kwa mwaka wa fedha,neutral
885,sw_train_00886,habari ahsante kwa uvumilivu wako pole sana kwa changamoto uliyoipata huduma ya internet sasa imerejea tunaendelea kuomba radhi kwa usumbufu uliopata ahsante kwa kuchagua vodacomll,neutral
886,sw_train_00887,wanaowezesha azaki changa wajikite katika kusaidia mifumo ya uendeshaji wa taasisi,neutral
887,sw_train_00888,mechi za kimataifa zinaendelea mechi zipo nyingi sana tuliza akili utengeneze pesa chaap mimi nimechagua chache t,neutral
888,sw_train_00889,serikali imeitaka bodi mpya ya baraza la uhifadhi na usimamizi wa mazingira nemc kudhibiti vitendo vya rushwa vinavyofanywa na baadhi ya watumishi wake pamoja na utoaji wa vyeti feki waziri wa nchi ofisi ya makamu wa rais muungano na mazingira aliyasema hayo,neutral
889,sw_train_00890,habari kifurushi cha internet huwa kinaisha kulingana na matumizi yako jitahidi kupunguza kiasi cha matumizi ya intaneti,neutral
890,sw_train_00891,kwenu mahari hata jero no problem waislam wa zamani lakinihapa naongelea kwetu wakristo,neutral
891,sw_train_00892,faida moja ya maskini wengi hawana magojwa ya kudumu km vile kisukaripreshamoyo kutanuka na hawana stress zakupindukia,neutral
892,sw_train_00893,ushauri wa bure tu hamieni benkiukisoma kipengere no iko wazi bot wanataka muhamie ukowanaenda kuongeza idadi kubwa y,neutral
893,sw_train_00894,hongera sana weka vocha zaidi na zaidi upate nafasi ya kujishindia zawadi mbalimbali kama kirikuu bodaboda baiskeli pesa taslim na simu za kisasa na jero yako promosheni,neutral
894,sw_train_00895, kwa wakati huu unaweza kupata zawadi ya kucheza jackpot moja bure kwa kushare bango kwa kupitia tovuti yetu bofya kushare bango la jackpot na kupata tiketi ya kucheza jackpot bure pa,neutral
895,sw_train_00896,wanaume hawapendi mzima mzima wanapenda vipande vipande anna mghwira ,neutral
896,sw_train_00897,ewe mdau wa sekta ya sanaa na utamaduniwahi kujisajili siku zimebaki chache kuelekea kufungwa kwa dirisha la usajili,neutral
897,sw_train_00898,serikali kupitia kitengo cha urejeshaji wa mali zilizopatikana kwa njia ya rushwa imefanikiwa kuokoa zaidi shilingi bilioni kutaifisha akaunti zenye thamani ya bilioni pamoja na kushinda kesi kati ya soma zaidi gtgt,neutral
898,sw_train_00899,utabiri wa hali ya hewa wa saa zijazo kuanzia saa usiku wa leo tarehe ,neutral
899,sw_train_00900,uhuru michezo goal simba sc al ahly kagere ,neutral
900,sw_train_00901,kweico kutoka kilimanjaro kazi walizofanya kuimarisha uchumi ndani ya nyumba na kuwatafutia masoko kuzuia ukatili wa,neutral
901,sw_train_00902,herbaby nataka tuwe kama na mekuwa kwanza coco ili niwe denge few minutes later her bloc,neutral
902,sw_train_00903,hili jambo halitaki kadamnasi but work on progressmambo ni kabisa kwa ground lakini,neutral
903,sw_train_00904,jibu lako ni twenzao app inayokuunganisha dereva wa gari binafsi na abiria wanaoenda mwelekeo wako inapatikana google p,neutral
904,sw_train_00905,nimegundua tunafanya makosa mengi sana tunafanya kazi nyingi sana lakini ni vitu vichache ambavyo tunavileta katika mi,neutral
905,sw_train_00906,teddy paul ni mwanamke mwenye degree ya it ifm na anamalizia masters degree ya international business udsm kwa sasa an,neutral
906,sw_train_00907,uwepo wa rushwa kwenye michakato ya kwenye vyama ni jambo linalosababisha wanawakwe wabaki nyuma kwenye kuwania nafasi za uon,neutral
907,sw_train_00908,mama wa watoto gb unazopatiwa baada ya kununua sma a zinatumika sehemu yeyote inayotumia internet tafadhali tufahamishe kama umekutana na changamoto yeyote ili tukusaidie,neutral
908,sw_train_00909,mkateswe kwa mamlaka ya ponsyo pilatomkafe mkazikwe mkafufuke siku ya tatu kama ilivyoandikwa mkapae mbiguni mmka,neutral
909,sw_train_00910,sisi ndio ali wako usipate usumbufu tena wa kupata dawa au vifaa tiba agiza kupita medpack app download on playstor,neutral
910,sw_train_00911, halafu chagua kutumakupost kwenye ukurasa wako wa facebook autwitter ukifanya hivyo utapelekwa moja kwa moja kwenye ukurasa wako wa facebook au twitter na utashareutapost bango hilo,neutral
911,sw_train_00912,malumbano ya hojafebruari usalama barabarani kwa watu wenye wanazingatia,neutral
912,sw_train_00913,tunataka suala la matumizi ya vyoo bora na unawaji wa mikono liwaguse watu wote,neutral
913,sw_train_00914,niite mr mstue dj kisifuri aguse ya kwa,neutral
914,sw_train_00915,epuka kumfikisha mwenza au rafiki mahala ambapo anapaswa kuchagua kati ya kuwa na wewe au kukata mahusiano na dunia circ,neutral
915,sw_train_00916,habari ahsante kwa kuwasiliana nasi naomba ututumie risiti namba ya muamala huo kwa msada zaidi ahsante wn,neutral
916,sw_train_00917,wakati wanasulubisha mkuu ile misumari walinunua hardware gani pale galilaya,neutral
917,sw_train_00918,is the best inareflect mengi wadada wanapitia kwenye hii mitandao ambayo wengi wetu hatuwezi elewa,neutral
918,sw_train_00919,katika kuadhimisha wiki ya huduma kwa mteja jana timu yetu ya masoko imetembelea eneo la ngaramtoniarusha ili kuwafikia,neutral
919,sw_train_00920,vibubu vipo dukani whatsapp join our whatsapp group for more tuko mwenge,neutral
920,sw_train_00921,sala na kazi,neutral
921,sw_train_00922,kiongozi wa korea kaskazini kim jongun amesema nchi yake inatafakari mtazamo wake endapo marekani itaendeleza vikwazo dhidi ya nchi hiyo kutokana na mpango wake wa silaha za nyuklia soma zaidi gtgt,neutral
922,sw_train_00923,muheshimiwa kwa majina naitwa rahma juma salumu mwanafunzi wa shule kuu ya uandishi wa habari udsmsjmc n,neutral
923,sw_train_00924,upo sahihi mhzitto akitaka kuelewa ataelewa vizuri sana lakini si kupotosha kama afanyavyo kuuliza si ujinga,neutral
924,sw_train_00925,sitasahau hii day mida ya saa mbili hv sehemu moja wanapaita itigi hapa morogoromara paap nkaona kundi kubwa lawatu linakimbia na mm nkafanya hivo hivomara mbele defender hio kushtuka kumbe walikuwa makahaba na drugdealers waliokuwa waankimbia pila,neutral
925,sw_train_00926,habarileo ijumaa januari ,neutral
926,sw_train_00927,mimi nikiona naambiwa hivyo ujue anasema sina muda na wewe sema anakuwa amepunguza ukali wa maneno,neutral
927,sw_train_00928,mitambo mipya ya mafunzo ya wataalam wa kuongoza ndege ya chuo cha usafiri wa anga kinachomilikiwa n,neutral
928,sw_train_00929,tatizo lako linafanyiwa kazi endelea kuwa mvumilivutunaomba radhi kwa usumbufu unaojitokezatumia ezypesa na ushinde,neutral
929,sw_train_00930,barafu ni nzuri kwa maumivu ya papo hapo yanayotokea mwilini kuliko maji ya moto huongeza usambazwaji wa damuhupunguza,neutral
930,sw_train_00931,habari onesmo jackpot ni rahisi tu unatakiwa ufanye utafiti mzuri juu ya mechi za jackpot ili uweze kuweka mkeka wako kwa usahihi wiki hii mechi za jackpot bado hazijawekwa tunaomba uwe na subira zitawekwa wakati wowote tembelea kwa taarifa,neutral
931,sw_train_00932,upo na mama mkwe kwenye gari yako aina ya vitz ghafla inawapita range rover spo kwa speed kali halafu mama mkwe anaj,neutral
932,sw_train_00933,dawa zinazotimika kutibu kifua kikuutb mafno rifampicin rifabutin dawa zinazotumika kutibu fungus mfano griseofulvin matibabu ya hiv infection ritonavir namna ya kutumia p meza kidonge cha kwanza baada ya kutoka kujamiana bila kinga,neutral
933,sw_train_00934,tanzaniadaima jumatatu januari ,neutral
934,sw_train_00935,anapenda kuvimba hatakama hana mia mfukoni,neutral
935,sw_train_00936,tenes ngole mkurugenzi taasisi ya kanzu data katika sekta ya madini kama tutakua na researchbased data katika sekta ya madini tutaweza kufanya informed decisions haswa kwenye mlengo wa sera na sheria zinazosimamia,neutral
936,sw_train_00937,habari tunaomba maelezo kuhusu changamoto hiyoka,neutral
937,sw_train_00938,jukumu letubro nawaona watu wa kwetu kwenye hii videomaskani kimara pale,neutral
938,sw_train_00939,benki ya yazindua kampeni ya kwa wateja wake,neutral
939,sw_train_00940,tunapenda kujua ulifanya lini ikawa hivyo,neutral
940,sw_train_00941,habariahsante kwa kuwasiliana nasi pole kwa changamoto unayoipata kutokana huduma za intanetitunapenda kufahamu kama bado unapata changamoto hiyo na kama bado tutumie kwenye dm namba yako kwa msaada zaidiahsante ea,neutral
941,sw_train_00942,physics kwa kiswahili fizikia ni elimu ya sayansi ya kani katika ugiligili mvutano na maada ya kikokotozi terezi sahi,neutral
942,sw_train_00943,washambuliaji leo ni xolim black,neutral
943,sw_train_00944,mwanaspoti ijumaa februari ,neutral
944,sw_train_00945,habari asante kwa kuwasiliana nasi pole na tafadhali tuandikie ujumbe unaopata na namba ya kadi kwa msaada zaidi salim,neutral
